courseCode;; courseName;; courseDescription;; coursePrereqs;; courseLevel;; courseSeasons
// ";;" is used for delimiter for headings: take note
// ", " is used for delimiter for coursePrereqs and courseSeasons
// make sure there are no trailing lines at the end of the file!!
//
// HS
HS;; High School;; Any course connected to this node has no prerequisites;; ;; 1;; 
// Transfer Credits
CHEM 120;; Physical and Chemical Properties of Matter;; The stoichiometry of compounds and chemical reactions. Properties of gases. Periodicity and chemical bonding. Energy changes in chemical systems. Electronic structure of atoms and molecules; correlation with the chemical reactivity of common elements, inorganic and organic compounds.;; HS;; 2;; F, W
CHEM 123;; Chemical Reactions, Equilibria and Kinetics;; Properties of liquids and solutions. Introduction to chemical equilibria. Principles of acid-base equilibria, solubility and electrochemical processes. Chemical kinetics.;; CHEM 120;; 3;; W, S
// 1A
MATH 145;; Algebra (Advanced Level);; An introduction to the language of mathematics and proof techniques through a study of the basic algebraic systems of mathematics: the integers, the integers modulo n, the rational numbers, the real numbers, the complex numbers and polynomials.;; HS;; 2;; F
MATH 147;; Calculus 1 (Advanced Level);; Absolute values and inequalities. Sequences and their limits. Introduction to series. Limits of functions and continuity. The Intermediate Value theorem and approximate solutions to equations. Derivatives, linear approximation, and Newton's method. The Mean Value theorem and error bounds. Applications of the Mean Value theorem, Taylor polynomials, and Taylor's theorem, Big-O notation. Suitable topics are illustrated using computer software.;; HS;; 2;; F
CS 145;; Designing Functional Programs (Advanced Level);; An introduction to the fundamentals of computer science through the application of elementary programming patterns in the functional style of programming. Syntax and semantics of a functional programming language. Tracing via substitution. Design, testing, and documentation. Linear and nonlinear data structures. Recursive data definitions. Abstraction and encapsulation. Generative and structural recursion. Historical context.;; HS;; 2;; F
PHIL 145;; Critical Thinking;; An analysis of basic types of reasoning, structure of arguments, critical assessment of information, common fallacies, problems of clarity and meaning.;; HS;; 2;; F, W, S
GEOG 101;; Human Geographies;; An introduction to human geography through key subfields of the discipline, examining population change, the rise of cities, our relationship to nature, social inequalities, economic forms, cultural difference and environmental change at the local and global scale.;; HS;; 2;; F, W, S
// 1B
MATH 146;; Linear Algebra 1 (Advanced Level);; Systems of linear equations, matrix algebra, elementary matrices, computational issues. Real n-space, vector spaces and subspaces, basis and dimension, rank of a matrix, linear transformations, and matrix representations. Determinants, eigenvalues and diagonalization, applications.;; MATH 145;; 3;; W
MATH 148;; Calculus 2 (Advanced Level);; Systems of linear equations, matrix algebra, elementary matrices, computational issues. Real n-space, vector spaces and subspaces, basis and dimension, rank of a matrix, linear transformations, and matrix representations. Determinants, eigenvalues and diagonalization, applications.;; MATH 147;; 3;; W
CS 146;; Elementary Algorithm Design and Data Abstraction (Advanced Level);; This course builds on the techniques and patterns learned in CS 135 while making the transition to use an imperative language. It introduces the design and analysis of algorithms, the management of information, and the programming mechanisms and methodologies required in implementations. Topics discussed include iterative and recursive sorting algorithms; lists, stacks, queues, trees, and their application; abstract data types and their implementations.;; CS 145;; 3;; W
PSYCH 101;; Introductory Psychology;; A general survey course designed to provide the student with an understanding of the basic concepts and techniques of modern psychology as a behavioural science.;; HS;; 3;; F, W, S
SPCOM 223;; Public Speaking;; Theory and practice of public speaking. A workshop course involving design and delivery of various kinds of speeches, and the development of organizational, vocal, listening, and critical skills. Students will be videotaped.;; HS;; 3;; F, W, S
// To be done (2A plan)
MATH 245;; Linear Algebra 2 (Advanced Level);; Orthogonal and unitary matrices and transformations. Orthogonal projections, Gram-Schmidt procedure, best approximations, least-squares. Inner products, angles and orthogonality, orthogonal diagonalization, singular value decomposition, applications.;; MATH 146;; 4;; F, S
MATH 247;; Calculus 3 (Advanced Level);; Calculus of functions of several variables. Limits, continuity, differentiability, the chain rule. The gradient vector and the directional derivative. Taylor's formula. Optimization problems. Mappings and the Jacobian. Multiple integrals in various co-ordinate systems.;; MATH 148;; 4;; F, W, S
MATH 249;; Introduction to Combinatorics (Advanced Level);; Introduction to graph theory: colourings, matchings, connectivity, planarity. Introduction to combinatorial analysis: generating series, recurrence relations, binary strings, plane trees.;; MATH 146;; 4;; F, W
STAT 240;; Probability (Advanced Level);; This course provides an introduction to probability models including sample spaces, mutually exclusive and independent events, conditional probability and Bayes' Theorem. The named distributions (Discrete Uniform, Hypergeometric, Binomial, Negative Binomial, Geometric, Poisson, Continuous Uniform, Exponential, Normal (Gaussian), and Multinomial) are used to model real phenomena. Discrete and continuous univariate random variables and their distributions are discussed. Joint probability functions, marginal probability functions, and conditional probability functions of two or more discrete random variables and functions of random variables are also discussed. Students learn how to calculate and interpret means, variances and covariances particularly for the named distributions. The Central Limit Theorem is used to approximate probabilities.;; MATH 145, MATH 147;; 4;; F
CS 245;; Logic and Computation;; Logic as a tool for representation, reasoning, and computation. Propositional and predicate logic. Formalizing the notions of correct and incorrect reasoning, defining what is computable, and exploring the limits of computation. Godel's Incompleteness Theorem. Applications of logic to computer science.;; MATH 146;; 4;; F, W, S
CS 246;; Object-Oriented Software Development;; Introduction to object-oriented programming and to tools and techniques for software development. Designing, coding, debugging, testing, and documenting medium-sized programs: reading specifications and designing software to implement them; selecting appropriate data structures and control structures; writing reusable code; reusing existing code; basic performance issues; debuggers; test suites. (CS 246e is offered in Fall);; CS 146;; 4;; F, W, S
// To be done (2B plan)
STAT 241;; Statistics (Advanced Level);; This course provides a systematic approach to empirical problem solving which will enable students to critically assess the sampling protocol and conclusions of an empirical study including the possible sources of error in the study and whether evidence of a causal relationship can be reasonably concluded. The connection between the attributes of a population and the parameters in the named distributions covered in STAT 230 will be emphasized. Numerical and graphical techniques for summarizing data and checking the fit of a statistical model will be discussed. The method of maximum likelihood will be used to obtain point and interval estimates for the parameters of interest as well as testing hypotheses. The interpretation of confidence intervals and p-values will be emphasized. The Chi-squared and t distributions will be introduced and used to construct confidence intervals and tests of hypotheses including likelihood ratio tests. Contingency tables and Gaussian response models including the two sample Gaussian and simple linear regression will be used as examples.;; MATH 148, STAT 240;; 5;; W
CS 240;; Data Structures and Data Management;; Introduction to widely used and effective methods of data organization, focusing on data structures, their algorithms, and the performance of these algorithms. Specific topics include priority queues, sorting, dictionaries, data structures for text processing.;; CS 245, CS 246, STAT 240;; 5;; F, W, S
CS 241;; Foundations of Sequential Programs;; The relationship between high-level languages and the computer architecture that underlies their implementation, including basic machine architecture, assemblers, specification and translation of programming languages, linkers and loaders, block-structured languages, parameter passing mechanisms, and comparison of programming languages. (CS 241e is offered in Fall);; CS 146;; 4;; F, W, S
CS 251;; Computer Organisation and Design;; Overview of computer organization and performance. Basics of digital logic design. Combinational and sequential elements. Data representation and manipulation. Basics of processor design. Pipelining. Memory hierarchies. Multiprocessors.;; CS 146;; 4;; F, W, S
// Other uncategorised courses (STAT)
STAT 330;; Mathematical Statistics;; This course provides a mathematically rigorous treatment for topics covered in STAT 230 and 231, and to make essential extensions to the multivariate case. Maximum likelihood estimation. Random variables and distribution theory. Generating functions. Functions of random variables. Limiting distributions. Large sample theory of likelihood methods. Likelihood ratio tests. Joint probability (density) functions, marginal probability (density) functions, and conditional probability (density) functions of two or more random variables are discussed. Topics covered include independence of random variables, conditional expectation and the determination of the distribution of functions of random variables using the cumulative distribution method, change of variable and moment generating functions. Properties of the Multinomial and Bivariate Normal distributions are proved. Limiting distributions, including convergence in probability and convergence in distribution, are discussed. Important results, including the Weak Law of Large Numbers, Central Limit Theorem, Slutsky's theorem, and the Delta Method, are introduced with applications. The maximum likelihood method is discussed for the multi-parameter case. Asymptotic properties of the maximum likelihood estimator are examined and used to construct confidence intervals or regions. Tests for simple and composite hypotheses are constructed using the Likelihood Ratio Test.;; MATH 247, STAT 240, STAT 241;; 6;; F, W, S
STAT 331;; Applied Linear Models;; Modeling the relationship between a response variable and several explanatory variables (an output-input system) via regression models. Least squares algorithm for estimation of parameters. Hypothesis testing and prediction. Model diagnostics and improvement. Algorithms for variable selection. Nonlinear regression and other methods.;; MATH 245, STAT 241;; 6;; F, W, S
STAT 341;; Computational Statistics and Data Analysis;; A computationally focused approach to statistical reasoning in the context of real data. Functional programming in R and algorithms will be used to define interesting attributes of finite populations and their sampling characteristics. Computational approaches to inductive inference and the assessment of predictive accuracy.;; MATH 247, STAT 241;; 6;; F, W
STAT 431;; Generalised Linear Models and their Applications;; Review of the normal linear model and maximum likelihood estimation; regression models for binomial, Poisson and multinomial data; generalized linear models; and other topics in regression modelling.;; STAT 330, STAT 331;; 8;; F, W, S
STAT 440;; Computational Inference;; Introduction to and application of computational methods in statistical inference. Monte Carlo evaluation of statistical procedures, exploration of the likelihood function through graphical and optimization techniques. Topics include expectation-maximization, Bootstrapping, Markov Chain Monte Carlo, and other computationally intensive methods.;; STAT 330, STAT 341;; 8;; W, S
STAT 441;; Statistical Learning;; Classification is the problem of predicting a discrete outcome from a set of explanatory variables. Main topics include logistic regression, neural networks, tree-based methods, support vector machines and nearest neighbour methods. Other topics include model assessment, training, and tuning.;; STAT 341, STAT 331;; 8;; F, W
STAT 442;; Data Visualisation;; Visualization methods applied to data. Both human perception and statistical properties inform the methods used to display and visually explore categorical, continuous, time-ordered, map, and high dimensional data. Order and layout effects on tables and graphics. Statistical concepts visually presented include variability, densities, quantiles, conditioning, and hypothesis testing. Interactive graphics include linking, brushing, motion, and the navigation of high dimensional spaces guided via projection indices. Glyphs (e.g., cartoon, statistical, or heatmap) and radial and parallel coordinates.;; STAT 341;; 8;; F, W
STAT 443;; Forecasting;; Modelling techniques for forecasting time series data: smoothing methods, regression including penalty/regularization methods, the Box-Jenkins framework, stationary and non-stationary processes, both with and without seasonal effects. Other topics may include: ARCH/GARCH models, Bayesian methods, dynamic linear models, Markov Chain Monte Carlo simulation, spectral density analysis, and periodograms.;; STAT 331;; 8;; F, W, S
STAT 444;; Statistical Learning - Advanced Regression;; This course introduces modern applied regression methods for continuous response modelling, emphasizing both explainability and predictive power. Topics cover a wide selection of advanced methods useful to address the challenges arising from real-world and high-dimensional data; methods include robust regression, nonparametric regression such as smoothing splines, kernels, additive models, tree-based methods, boosting and bagging, and penalized linear regression methods such as the ridge regression, lasso, and their variants. Students will gain an appreciation of the mathematical and statistical concepts underlying the methods and also computational experience in applying the methods to real data.;; STAT 331, STAT 341;; 8;; W, S 
// Other uncategorised courses (CS)
CS 341;; Algorithms;; The study of efficient algorithms and effective algorithm design techniques. Program design with emphasis on pragmatic and mathematical aspects of program efficiency. Topics include divide and conquer algorithms, recurrences, greedy algorithms, dynamic programming, graph search and backtrack, problems without algorithms, NP-completeness and its implications.;; CS 240, MATH 249;; 6;; F, W, S
CS 348;; Introduction to Database Management;; The main objective of this course is to introduce students to fundamentals of database technology by studying databases from three viewpoints: those of the database user, the database designer, and the database administrator. It teaches the use of a database management system (DBMS) by treating it as a black box, focusing only on its functionality and its interfaces. Topics include introduction to database systems, relational database systems, database design methodology, SQL and interfaces, database application development, concept of transactions, ODBC, JDBC, database tuning, database administration, and current topics (distributed databases, data warehouses, data mining).;; CS 240;; 6;; F, W, S
CS 350;; Operating Systens;; An introduction to the fundamentals of operating system function, design, and implementation. Topics include concurrency, synchronization, processes, threads, scheduling, memory management, file systems, device management, and security.;; CS 240, CS 241, CS 246, CS 251;; 6;; F, W, S
CS 451;; Data-Intensive Distributed Computing;; Introduces students to infrastructure for data-intensive computing, with a focus on abstractions, frameworks, and algorithms that allow developers to distribute computations across many machines.  Topics include core concepts (partitioning, replication, locality, consistency), computational models (MapReduce, dataflows, stream processing, bulk-synchronous parallel), and applications.;; CS 341, CS 348, CS 350;; 8;; F, W
CS 448;; Database Systems Implementation;; The objective of this course is to introduce students to fundamentals of building a relational database management system. The course focuses on the database engine core technology by studying topics such as storage management (data layout, disk-based data structures), indexing, query processing algorithms, query optimization, transactional concurrency control, logging and recovery.;; CS 348, CS 350;; 8;; W
CS 454;; Distributed Systems;; An introduction to distributed systems, emphasizing the multiple levels of software in such systems. Specific topics include fundamentals of data communications, network architecture and protocols, local-area networks, concurrency control in distributed systems, recovery in distributed systems, and clock synchronization.;; CS 350;; 8;; W, S
CS 480;; Introduction to Machine Learning;; Introduction to modeling and algorithmic techniques for machines to learn concepts from data. Generalization: underfitting, overfitting, cross-validation. Tasks: classification, regression, clustering. Optimization-based learning: loss minimization. regularization. Statistical learning: maximum likelihood, Bayesian learning. Algorithms: nearest neighbour, (generalized) linear regression, mixtures of Gaussians, Gaussian processes, kernel methods, support vector machines, deep learning, sequence learning, ensemble techniques. Large scale learning: distributed learning and stream learning. Applications: Natural language processing, computer vision, data mining, human computer interaction, information retrieval.;; CS 341, STAT 241;; 8;; F, W, S
CS 485;; Statistical and Computational Foundations of Machine Learning;; Extracting meaningful patterns from random samples of large data sets. Statistical analysis of the resulting problems. Common algorithmic paradigms for such tasks. Central concepts: VC-dimension, margins of a classifier, sparsity and description length, other types of regularization. Performance guarantees: generalization bounds, data dependent error bounds and computational complexity of learning algorithms. Common paradigms: neural networks, kernel methods and support-vector machines, boosting, nearest neighbor classifiers. Applications to data mining.;; CS 341;; 8;; F, W, S
CS 486;; Introduction to Artificial Intelligence;; Goals and methods of artificial intelligence. Methods of general problem solving. Knowledge representation and reasoning. Planning. Reasoning about uncertainty. Machine learning. Multi-agent systems. Natural language processing.;; CS 341, STAT 241;; 8;; F, W, S
// Other uncategorised courses (CO)
CO 487;; Applied Cryptography;; A broad introduction to cryptography, highlighting the major developments of the past twenty years. Symmetric ciphers, hash functions and data integrity, public-key encryption and digital signatures, key establishment, key management. Applications to Internet security, computer security, communications security, and electronic commerce.;; MATH 145, STAT 240;; 8;; W
// end of file